{"kimdan_agent":"S3","kanal":"tg","kimga":{"tur":"talaba","id":"gc:10877","telegram_id":123456789,"telefon":"+998935550011"},"skript_id":"S-001","til":"uz","ozgaruvchilar":{"ism":"Bekzod","kurs":"Buxgalter noldan","summa":"1 200 000","sana":"1-oktyabr"},"idempotent_kalit":"S3:S-001:gc:10877:2026-10-01","muhimlik":"oddiy"}
